{
  "required" : true ,
  "$schema" : "http://json-schema.org/draft-03/schema" ,
  "type" : "object" ,
  "properties" : {
    "id" : {
      "type" : "array" ,
      "required" : false ,
      "items" : [
        {
          "type" : "string"
        }
      ]
    } ,
    "latitute" : {
      "type" : "string" ,
      "required" : false
    } ,
    "longitude" : {
      "type" : "string" ,
      "required" : false
    } ,
    "codigosiafi" : {
      "type" : "string" ,
      "required" : false
    } ,
    "estado" : {
      "type" : "string" ,
      "required" : false
    } ,
    "nome" : {
      "type" : "string" ,
      "required" : false
    } ,
    "regiao" : {
      "type" : "string" ,
      "required" : false
    }
  }
}