{
  "nome" : "some value" ,
  "regiao" : "some value" ,
  "estado" : "some value" ,
  "latitute" : "some value" ,
  "longitude" : "some value" ,
  "codigosiafi" : "some value" ,
  "id" : [
    "some value" ,
    "some value" ,
    "some value" ,
    "some value" ,
    "some value" ,
    "some value" ,
    "some value" ,
    "some value"
  ]
}